{
  "plan_id": "plan-demo-001",
  "plan_type": "daily",
  "date_range": "03-Feb-2026",
  "owner": "Nadeem Ahmed",
  "tasks": [
    {
      "task_id": "t-001",
      "title": "Morning lead follow-ups",
      "time_block": "10:00\u201311:00 IST",
      "priority": "P1",
      "dependency": "",
      "buffer_minutes": 10,
      "expected_outcome": "Reconnect with warm leads",
      "status": "planned"
    },
    {
      "task_id": "t-002",
      "title": "Site visit \u2013 Project review",
      "time_block": "12:00\u201314:00 IST",
      "priority": "P1",
      "dependency": "",
      "buffer_minutes": 30,
      "expected_outcome": "Client walkthrough completed",
      "status": "planned"
    }
  ],
  "assumptions": [
    "No meetings before 10:00 IST",
    "Travel time between locations is 30 minutes"
  ]
}